{
 "schema": "professional-slides.quality-anchors/v1",
 "$comment": "Rendered pages with a known place on the judge's scale. Provisional until a person scores each one on the rubric's 1-10 page scale; the runner reports the judge's mean absolute error over the anchors that carry a humanScore and skips the rest.",
 "scale": {
  "min": 1,
  "max": 10
 },
 "anchors": [
  {
   "id": "high-page-types-02",
   "tier": "high",
   "image": "images/high-page-types-02.jpg",
   "source": {
    "kind": "example",
    "deck": "page-types",
    "page": 2
   },
   "why": "Executive summary as a lever table with a reading column: the answer, its size and its conditions in one view.",
   "sha256": "899f7d06adb02fe416f3eaf8d0a180e64df1f15f25d1e2b493dfac2c8dbb94aa",
   "provisional": true,
   "humanScore": null
  },
  {
   "id": "high-page-types-06",
   "tier": "high",
   "image": "images/high-page-types-06.jpg",
   "source": {
    "kind": "example",
    "deck": "page-types",
    "page": 6
   },
   "why": "One dated series with its trough and recovery annotated; the title is the finding the line shows.",
   "sha256": "57a174688454da082207de978e224440d8e5711f76049ba97a61611a07fd0e14",
   "provisional": true,
   "humanScore": null
  },
  {
   "id": "high-page-types-09",
   "tier": "high",
   "image": "images/high-page-types-09.jpg",
   "source": {
    "kind": "example",
    "deck": "page-types",
    "page": 9
   },
   "why": "Small multiples on one scale, each panel closing on its own reading.",
   "sha256": "a33bfe6fb5f500ebd05ee8b6c9f7e911a4f38b2425efd14522cc2af13f939117",
   "provisional": true,
   "humanScore": null
  },
  {
   "id": "high-page-types-17",
   "tier": "high",
   "image": "images/high-page-types-17.jpg",
   "source": {
    "kind": "example",
    "deck": "page-types",
    "page": 17
   },
   "why": "A bridge that decomposes the change the title names, every step labelled.",
   "sha256": "97e7ab663546361b9c22bcc7aa33d28ec63664da8c096654feca095a414bbf1f",
   "provisional": true,
   "humanScore": null
  },
  {
   "id": "high-page-types-21",
   "tier": "high",
   "image": "images/high-page-types-21.jpg",
   "source": {
    "kind": "example",
    "deck": "page-types",
    "page": 21
   },
   "why": "A coded scorecard (harvey balls) with the verdict column read across and a sequencing takeaway.",
   "sha256": "ae636622fecd2d8c8b72892d20691e8b2308b5fd7abec87c93cacae55fe63552",
   "provisional": true,
   "humanScore": null
  },
  {
   "id": "high-page-types-28",
   "tier": "high",
   "image": "images/high-page-types-28.jpg",
   "source": {
    "kind": "example",
    "deck": "page-types",
    "page": 28
   },
   "why": "Three panels that carry one mechanism from cause to effect, each marking what it adds.",
   "sha256": "be5a4282fb231a3ab4ebc0f2c7e162f310037cd05d90885f8aa54ac9ca545162",
   "provisional": true,
   "humanScore": null
  },
  {
   "id": "high-page-types-30",
   "tier": "high",
   "image": "images/high-page-types-30.jpg",
   "source": {
    "kind": "example",
    "deck": "page-types",
    "page": 30
   },
   "why": "A keyed map: places the argument turns on, each named where it sits.",
   "sha256": "49581fe4acb5013dccf8b68bcf687c2a1f22dd736c26e2ba6658f026b2a9d3a6",
   "provisional": true,
   "humanScore": null
  },
  {
   "id": "high-page-types-40",
   "tier": "high",
   "image": "images/high-page-types-40.jpg",
   "source": {
    "kind": "example",
    "deck": "page-types",
    "page": 40
   },
   "why": "A milestone tracker with owners, dates and status coded, read against the plan.",
   "sha256": "0e66b3cc7ab71538ad642d688d95c8281f924ef7077e5619a208a8b4e623f8ab",
   "provisional": true,
   "humanScore": null
  },
  {
   "id": "high-gallery-08",
   "tier": "high",
   "image": "images/high-gallery-08.jpg",
   "source": {
    "kind": "example",
    "deck": "gallery-acceptance",
    "page": 8
   },
   "why": "A status table whose status and progress cells are coded rather than written.",
   "sha256": "d6aa7908e5b3d7f53250db154676e85447bb98a6f4f34d37252cb90a19422fd2",
   "provisional": true,
   "humanScore": null
  },
  {
   "id": "high-gallery-35",
   "tier": "high",
   "image": "images/high-gallery-35.jpg",
   "source": {
    "kind": "example",
    "deck": "gallery-acceptance",
    "page": 35
   },
   "why": "A stacked column over time with the shift the title claims visible in the stacks.",
   "sha256": "39bb54cead9a93754e1a12e9f59d1f775c12a98e064ae6b7a51aaf09fa98ad5a",
   "provisional": true,
   "humanScore": null
  },
  {
   "id": "low-specimen-02",
   "tier": "low",
   "image": "images/low-specimen-02.jpg",
   "source": {
    "kind": "specimen",
    "deck": "anthropic-vs-openai-2026",
    "page": 2
   },
   "defectClass": "dead-space",
   "why": "A 239-word summary packed into the upper half; the lower half is empty.",
   "sha256": "650da4723e8553b56cc0cc2d8ca51d27d30c30d5328150ef8ad03f89fe25df02",
   "provisional": true,
   "humanScore": null
  },
  {
   "id": "low-specimen-10",
   "tier": "low",
   "image": "images/low-specimen-10.jpg",
   "source": {
    "kind": "specimen",
    "deck": "anthropic-vs-openai-2026",
    "page": 10
   },
   "defectClass": "number-cards",
   "why": "Three facts in full-width grey cards: a large surface spent on a handful of numbers.",
   "sha256": "cd74e1983915da2495f25df227d7d5ceb9a7d1525198d130fe51ebc0c327defa",
   "provisional": true,
   "humanScore": null
  },
  {
   "id": "low-specimen-15",
   "tier": "low",
   "image": "images/low-specimen-15.jpg",
   "source": {
    "kind": "specimen",
    "deck": "anthropic-vs-openai-2026",
    "page": 15
   },
   "defectClass": "chart-form",
   "why": "A time series drawn as an unlabelled scatter; two evidence tiers share one series with no legend.",
   "sha256": "564602839886b5f59c390d9c9656c3018ecf17e74641963b47bf62116b9abb2d",
   "provisional": true,
   "humanScore": null
  },
  {
   "id": "low-specimen-22",
   "tier": "low",
   "image": "images/low-specimen-22.jpg",
   "source": {
    "kind": "specimen",
    "deck": "anthropic-vs-openai-2026",
    "page": 22
   },
   "defectClass": "collision",
   "why": "A small flow floating in an empty field, with its edge labels colliding with the connectors.",
   "sha256": "32e8fb56ae83fe481da5c47c6720ac8bb7ca0641fab6aa6752e76782575eefe6",
   "provisional": true,
   "humanScore": null
  },
  {
   "id": "low-specimen-29",
   "tier": "low",
   "image": "images/low-specimen-29.jpg",
   "source": {
    "kind": "specimen",
    "deck": "anthropic-vs-openai-2026",
    "page": 29
   },
   "defectClass": "dead-space",
   "why": "A sparse table that leaves a large field empty while the claim needs a common-basis comparison.",
   "sha256": "5186fed22b1e615daf99eb37cc649d6ac79759ffbe71a28699ddc7f3a0757bc0",
   "provisional": true,
   "humanScore": null
  },
  {
   "id": "low-specimen-30",
   "tier": "low",
   "image": "images/low-specimen-30.jpg",
   "source": {
    "kind": "specimen",
    "deck": "anthropic-vs-openai-2026",
    "page": 30
   },
   "defectClass": "legend",
   "why": "A multi-series scatter with no legend or direct labels for its series.",
   "sha256": "7c3790f89c5e8b32bb964296fa05348151516bc68fcc956288fc881aed178eeb",
   "provisional": true,
   "humanScore": null
  },
  {
   "id": "low-specimen-41",
   "tier": "low",
   "image": "images/low-specimen-41.jpg",
   "source": {
    "kind": "specimen",
    "deck": "anthropic-vs-openai-2026",
    "page": 41
   },
   "defectClass": "dead-space",
   "why": "A flow and a list that leave the lower region blank after repeating an earlier distinction.",
   "sha256": "b75d2f4042de30b1890ec68d10060a319c2c070a0b8671d907e3cabaf3e30105",
   "provisional": true,
   "humanScore": null
  },
  {
   "id": "low-specimen-48",
   "tier": "low",
   "image": "images/low-specimen-48.jpg",
   "source": {
    "kind": "specimen",
    "deck": "anthropic-vs-openai-2026",
    "page": 48
   },
   "defectClass": "collision",
   "why": "A scatter whose labels collide with marks and with each other.",
   "sha256": "ac57cd6cbc90978846c0300da881307625d9e475125a889dbaa0d997c7d43f5b",
   "provisional": true,
   "humanScore": null
  }
 ]
}
